title;url
Pazuello diz que são no máximo três as opções de vacina contra a Covid para Brasil;https://www1.folha.uol.com.br/equilibrioesaude/2020/12/pazuello-diz-que-sao-no-maximo-tres-as-opcoes-de-vacina-contra-a-covid-para-brasil.shtml
Brasil deve se preparar para esticar auxílios e estímulos à economia, aponta FMI;https://www1.folha.uol.com.br/mercado/2020/12/fmi-diz-que-brasil-deve-se-preparar-para-esticar-auxilios-e-estimulos-a-economia.shtml
Conta de luz de Itaipu financia estradas, Itamaraty e até vitrais;https://www1.folha.uol.com.br/mercado/2020/12/conta-paga-a-itaipu-financia-estradas-sede-do-itamaraty-e-ate-vitrais.shtml
"Grupo invade cidade no Pará, faz reféns e ataca banco; um morre";https://www1.folha.uol.com.br/cotidiano/2020/12/cameta-no-para-e-alvo-de-quadrilha-de-assaltantes-um-dia-apos-acao-violenta-em-criciuma-sc.shtml
'Bossa Nova é uma máquina de investimentos em startups', diz Pierre Schürmann;https://www1.folha.uol.com.br/mercado/2020/12/bossa-nova-e-uma-maquina-de-investimentos-em-startups-diz-pierre-schurmann.shtml
MEC determina aula presencial em federais, institutos e faculdades privadas em janeiro;https://www1.folha.uol.com.br/educacao/2020/12/mec-determina-retorno-das-aulas-presenciais-nas-universidades-federais-a-partir-de-janeiro.shtml
Minoria, prefeitos rejeitados em SP culpam pandemia e falta de água;https://www1.folha.uol.com.br/poder/2020/12/minoria-prefeitos-rejeitados-nas-urnas-em-sp-culpam-pandemia-e-falta-de-agua.shtml
Em conversa com Huck, Macri relata experiência como presidente argentino;https://www1.folha.uol.com.br/colunas/painel/2020/12/em-conversa-com-huck-macri-relata-experiencia-como-presidente-argentino.shtml
Nos EUA, democratas atacam Bolsonaro e pedem proteção a Talíria Petrone;https://www1.folha.uol.com.br/mundo/2020/12/nos-eua-democratas-atacam-bolsonaro-e-pedem-protecao-a-taliria-petrone.shtml
Justiça investiga propina para Casa Branca em concessões de perdão presidencial nos EUA;https://www1.folha.uol.com.br/mundo/2020/12/justica-investiga-propina-para-casa-branca-em-concessoes-de-perdao-presidencial-nos-eua.shtml
Folha oferece assinatura grátis para professores;https://www1.folha.uol.com.br/poder/2020/10/folha-oferece-assinatura-gratis-para-professores-das-redes-publica-e-privada.shtml
Conheça a história do xadrez;https://www1.folha.uol.com.br/webstories/cultura/2020/11/a-historia-do-xadrez/
Consultoria que contratou Moro já faturou R$ 17,6 milhões com crise da Odebrecht;https://www1.folha.uol.com.br/poder/2020/12/consultoria-que-contratou-moro-ja-faturou-r-176-milhoes-com-crise-da-odebrecht.shtml
Mais famoso ativista pró-democracia em Hong Kong é condenado a 13 meses de prisão;https://www1.folha.uol.com.br/mundo/2020/12/mais-famoso-ativista-pro-democracia-em-hong-kong-e-condenado-a-13-meses-de-prisao.shtml
Israel aprova dissolução do Parlamento e avança para 4ª eleição em 2 anos;https://www1.folha.uol.com.br/mundo/2020/12/israel-aprova-dissolucao-do-parlamento-e-avanca-para-4a-eleicao-em-2-anos.shtml
"INSS divulga calendário de pagamentos para 2021; confira as datas";https://agora.folha.uol.com.br/grana/2020/12/inss-divulga-calendario-de-pagamentos-para-2021.shtml
Seis meses após a morte do filho, mãe de Miguel diz que luta por Justiça interrompeu o luto;https://www1.folha.uol.com.br/cotidiano/2020/12/seis-meses-apos-a-morte-do-filho-mae-de-miguel-diz-que-luta-por-justica-interrompeu-o-luto.shtml
Tribunal europeu dá luz verde para processo movido por jovens contra aquecimento global;https://www1.folha.uol.com.br/ambiente/2020/12/tribunal-europeu-da-luz-verde-para-processo-movido-por-jovens-portugueses-contra-aquecimento-global.shtml
Autógrafo mais valorizado no futebol não é de Pelé, Maradona, Messi ou CR7;https://omundoeumabola.blogfolha.uol.com.br/?p=20482
Queda do Fla mostra o planeta Bola frágil na pandemia;https://www1.folha.uol.com.br/colunas/jucakfouri/2020/12/eliminacao-do-flamengo-mostra-como-esta-fragil-o-planeta-bola-sob-a-pandemia.shtml
US responds to drug crisis with legalization and treatment;https://arte.folha.uol.com.br/mundo/2020/altered-state-drug-policy-around-the-world/united-states/harm-reduction-and-legalization/
"Brasil fica de fora dos melhores destinos de 2021 do Lonely Planet; veja lista";https://www1.folha.uol.com.br/turismo/2020/12/brasil-fica-de-fora-dos-melhores-destinos-de-2021-do-lonely-planet-veja-lista.shtml
'Trolls 2' merece ir ao hall da fama de desenhos para crianças e adultos;https://www1.folha.uol.com.br/ilustrada/2020/12/trolls-2-merece-ir-ao-hall-da-fama-de-desenhos-para-criancas-e-adultos.shtml
Novo terror 'Amizade Maldita' foge dos medos mais tradicionais, mas fracassa;https://www1.folha.uol.com.br/ilustrada/2020/12/filme-amizade-maldita-pertence-a-vasta-saga-de-terrores-mais-frouxos.shtml
Elliot Page, que anunciou ser trans, questionou Bolsonaro sobre homofobia em 2016;https://f5.folha.uol.com.br/celebridades/2020/12/elliot-page-ator-que-anunciou-ser-trans-questionou-bolsonaro-sobre-homofobia-em-entrevista-de-2016.shtml
Palmirinha volta a ser internada após passar mal e está na UTI, em São Paulo;https://f5.folha.uol.com.br/celebridades/2020/12/palmirinha-volta-a-ser-internada-apos-passar-mal-e-esta-na-uti.shtml
Ruína amazônica;https://www1.folha.uol.com.br/opiniao/2020/12/ruina-amazonica.shtml
Riscos em trilhões;https://www1.folha.uol.com.br/opiniao/2020/12/riscos-em-trilhoes.shtml
Refis da Covid e as externalidades expostas pela transação;https://www1.folha.uol.com.br/opiniao/2020/12/refis-da-covid-e-as-externalidades-expostas-pela-transacao.shtml
O racismo e o preconceito com a função policial;https://www1.folha.uol.com.br/opiniao/2020/12/o-racismo-e-o-preconceito-com-a-funcao-policial.shtml
'Não há mais espaço para salvadores da pátria', diz leitor;https://www1.folha.uol.com.br/paineldoleitor/2020/12/nao-ha-mais-espaco-para-salvadores-da-patria-diz-leitor.shtml
Qual o melhor programa de variedades? Vote no Prêmio F5;https://f5.folha.uol.com.br/premio-f5/2020/11/premio-f5-veja-indicados-e-vote-nos-principais-destaques-do-entretenimento-em-2020.shtml
Maior legado de Schroder é o resgate da credibilidade do jornalismo da Globo;https://f5.folha.uol.com.br/colunistas/tonygoes/2020/12/maior-legado-de-schroder-e-o-resgate-da-credibilidade-do-jornalismo-da-globo.shtml
Cliente deixa gorjeta de cerca de R$ 15 mil para funcionários de restaurante na pandemia;https://f5.folha.uol.com.br/voceviu/2020/12/cliente-deixa-gorjeta-de-r-156-mil-para-funcionarios-de-restaurante-fechado-por-coronavirus.shtml
Mãe morre na frente dos filhos após árvore cair sobre carro de família;https://agora.folha.uol.com.br/sao-paulo/2020/12/queda-de-arvore-deixa-quatro-feridos-na-vila-mariana-em-sp.shtml
